{
  "apiVersion": "nexus.io/v1alpha2",
  "kind": "PackageAccessPolicy",
  "metadata": {
    "package": "comms-core",
    "version": "1.0.4"
  },
  "spec": {
    "visibility": "public",
    "publisher_verification": "official",
    "license": "Apache-2.0",
    "required_entitlements": [],
    "mirrorable": true,
    "requires_hub_account": false,
    "distribution": "direct_download"
  }
}
